origem,topico,arquivo,texto
training,coffee,0008656,ny analysts see coffee futures falling further new york april new york coffee futures prices will probably fall to about cents a lb in the next month before a consolidation trend sets in according to market analysts yesterday prices for the spot may contract fell below dlr a lb for the first time since august after the international coffee organization did not place new export quota discussions on its current agenda talks aimed at renegotiating ico export quotas after five years of pricesupporting agreements broke down in february shortterm it looks like a definite test of cents perhaps cents said william oneill coffee analyst with elders futures but the additional downside may not be all that great from current levels at this price level the market is very vulnerable to bullish developments oneill added rather than us having a market that will plummet well kind of see prices erode probably to around cents i definitely see cents and would not rule out a brief drop to cents said debra tropp a coffee analyst with prudential bache but she said by june worries about a freeze in brazil growing areas will become more of a market factor with prices likely to consolidate ahead of that time a trader at a major international trade house who asked not to be named said he expects a cent drop near term but believes if brazil opens may registrations at a relatively high export price and requires a high contribution quota from exporters the market could steady at the lower levels longer term he added producer pressure will mount on brazil to agree to consumers export quota terms and a new international agreement could come into force next fall since the february talks broke down the market has fallen from about cents a lb to a low of cents a lb today as buyers and sellers sought to reassess supply and demand generally analysts say producers have a large buildup of stocks but us roasters have drawn down supplies and will need to do some buying soon most producing nations have just completed or are about to complete their annual harvests and exportable supplies are at their seasonal peak exports remain behind year ago and warehouses in producer nations are becoming increasingly overburdened said sandra kaul coffee analyst for shearson lehman in that firms forthcoming quarterly coffee report kaul said producers need to procure hard currency to service foreign debt will put further pressure on them to sell and this should keep substantial pressure on exporters to undertake sales despite the drop in prices to six year lows kaul believes the market will drop to cents a lb before brazils frost season begins in june accurate assessments of roaster demand are hard to come by though analysts note the peak winter consumption period is passed and demand usually slows this time of year shearsons kaul estimated us roaster ending stocks as of january including soluble and roasted at mln bags compared with mln at endseptember a small drawdown for the usually busy winter roasting season but elders oneill said the roasters are not overstocked by any means analysts said picking a bottom to the market is difficult given the fact prices have fallen into uncharted territory below the longterm support at dlr per lb and several traders said the sidelines might be preferable for the short term
training,coffee,0009271,ibc registers mln bags of export sales rio de janeiro april the brazilian coffee institute today registered mln kilo bags of green coffee for may shipment an ibc statement said this brings the total in the two days registrations have been open to mln including bags of soluble todays registrations comprised bags to members and to nonmembers of the international coffee organisation no soluble sales were registered today
training,coffee,0005674,coffee conference ends with call to continue talks managua march a meeting of eight latin american coffee producers ended with a call for continued talks aimed at arriving at an agreement to stabilize international prices a statement delivered by the conferences president nicaraguas external trade minister alejandro martinez cuenca said the object of future meetings would be to seek negotiations leading to basic export quotas the meeting was attended by representatives from brazil mexico guatemala el salvador honduras costa rica and nicaragua a panamanian representative attended the meeting as an observer representatives at the meeting said efforts would continue to be made to reach a regional consensus on export quotas which could be presented to the international coffee organization in opening the meeting nicaraguan president daniel ortega said the lack of an accord on export quotas was behind falling coffee prices which he said have caused billions of dollars in losses to countries in the region jorio dauster president of the brazilian coffee institute said his government is committed to working towards an producers accord in order to bring about higher prices
training,coffee,0007964,csce restructures coffee futures daily limits new york march the coffee sugar and cocoa exchange has expanded the normal daily trading limit in coffee c contracts to cents a lb from the previous cents effective today the csce said the new daily limits apply to all but the two nearby positions currently may and july which trade without limits in addition the cent limit can be increased to cents a lb if the first two limited months both make limit moves in the same direction for two consecutive sessions according to the csce announcement before the rule change today the csce required two days of limit moves in the first three restricted contracts before expanding the daily trading limit under new guidelines if the first two restricted deliveries move the cent limit for two days the exchange will expand the limit the expanded cent limit will remain in effect until the settling prices on both of the first two limited months has not moved by more than the normal cent limit for other contracts in two successive trading sessions the csce said
training,coffee,0006812,dauster says no change in brazils coffee policy rio de janeiro march brazil will not announce any changes to its coffee export policy brazilian coffee institute ibc president jorio dauster said he told reuters brazil was not planning to modify the position it held before the recent international coffee organisation meeting earlier this month talks in london to set new ico export quotas failed commenting on the outcome of a coffee producers meeting in managua last weekend dauster said that they discussed nothing involving the market in the meeting we agreed to work on behalf of the union of the producers in matters related to an international agreement dauster said the managua meeting was attended by representatives from brazil mexico guatemala el salvador honduras costa rica nicaragua and panama the latter represented at the meeting merely as an observer
training,coffee,0007851,india reduces export duty on coffee new delhi march india cut the export duty on coffee to rupees per kg from rupees effective march a coffee board official said the reduction should help india reach its coffee export target of tonnes in fiscal ending march against provisionally estimated exports of tonnes in and an actual tonnes in he said india is likely to press for international export quotas at a meeting of coffee producers in london this week because of depressed prices he added the international coffee organisation which represents both consumers and producers has so far failed to reach agreement on quotas india feels it will be useful to have quotas now because the slide in prices is unlikely to be halted immediately he said export quotas were suspended in february when market prices surged after a drought devastated brazils coffee crop
training,coffee,0003558,no heavy coffee export impliedcolombia official bogota march a decision by colombia to open coffee export registrations for an unlimited amount does not imply the country will heavily sell coffee until recently withheld gilberto arango president of the private exporters association told reuters colombia today opened export registrations for april and may with the national coffee growers federation setting no limit since the start of the coffee year last october private exporters were on average allowed bags of kilos per month traders will initially interpret this measure as announcing heavy sales even today it pressured the market but it will quickly become apparent that colombia does not intend to go over the top arango said in an interview colombias marketing policy is to sell without haste but consistently no targets for volume will be set we will react to market factors adequately colombia has no intention to give its coffee away he added arango described measures adopted here yesterday including a lower export registration price as a major change in colombias coffee marketing policy the export registration price or reintegro was lowered to dlr per lb exdock new york or dlrs per bag of kilos from dlrs dlrs the government announced a more flexible policy of reintegro in order to closely reflect market trends which arango warmly welcomed saying private exporters will undoubtedly be more actively present in the market a frequent gap between international market prices and the reintegro was unlikely to recur he said
training,coffee,0007660,us sees no new coffee agreement talks soon washington march the united states does not expect the executive board meeting of the international coffee organization ico to call for a new round of negotiations on reinstating coffee quotas a us government official said the official a member of the us delegation to ico talks earlier this year said no new coffee agreement talks are expected because there is no indication the negotiating positions of major producers and consumers have changed the us still demands as a condition of reimposition of coffee quotas that objective criteria be set for establishing quotas said the us official who asked not to be identified brazil the major producer insists on quotas based on a traditional formula the us remains open to a negotiating meeting but only if some new flexibility is apparent from major countries the official said the ico executive board meets tomorrow in london
training,coffee,0004997,colombia will not attend managua coffee meeting bogota march colombia will not attend a meeting of coffee producing countries scheduled for this weekend in nicaragua jorge cadenas manager of the national coffee growers federation said we prefer to wait until things are better prepared he told reuters he added the meeting could be postponed colombia brazil and the central american coffee producing countries were invited to the meeting in managua to analyze the market situation however he did not dismiss the idea of dialogue and negotiation in preparation for meetings of the international coffee organization gilberto arango president of colombias exporters association speaking to reuters earlier this week ruled out a fresh colombian initiative on export quotas saying producers had now to show a common resolve which could emerge from continuous contacts the international coffee organization executive board is to meet in london between march and april
training,coffee,0000527,coffee traders expect selloff after ico talks fail author by lisa vaughan reutersauthor london march the failure of the international coffee organization ico to reach agreement on coffee export quotas could trigger a massive selloff in london coffee futures of at least stg per tonne today coffee trade sources said prices could easily drop to as low as dlr or even cents a lb this year from around dlrs now they said a special meeting between importing and exporting countries ended in a deadlock late yesterday after eight days of talks over how to set the quotas no further meeting to discuss quotas was set delegates said quotas the major device used to stabilize prices under the international coffee agreement were suspended a year ago after prices soared following a damaging drought in brazil with no propects for quotas in sight heavy producer selling initially and a price war among commercial coffee roasting companies will ensue the trade sources predicted lower prices are sure to trickle down to the supermarket shelf this spring coffee dealers said the us and brazil the largest coffee importer and exporter respectively each laid the blame on the other for the breakdown of the talks jon rosenbaum us assistant trade representative and delegate to the talks said in a statement after the council adjourned a majority of producers led by brazil were not prepared to negotiate a new distribution based on objective criteria we want to insure that countries receive export quotas based on their ability to supply the market instead of their political influence in the ico brazilian coffee institute ibc president jorio dauster countered negotiations failed because consumers tried to dictate quotas not negotiate them previously quotas were determined by historical amounts exported which gave brazil a pct share of a global market of about mln kilo bags a majority of producers wanted quotas to continue under this basic scheme but most consumers and a maverick group of eight producers proposed carving up the export market on the basis of exportable production and stocks which would reduce brazils share to pct consumer delegates said this method would reflect changes in many countries export capabilities and make coffee more readily available to consumers when they need it a lastminute attempt by colombia the second largest exporter to rescue the talks with a compromise interim proposal could not bring the two sides together delegates speculated brazils financial problems illustrated by its recent suspension of interest payments on bank debt have increased political pressure on the country to protect its coffee export earnings developing coffeeproducing countries that depend heavily on coffee earnings particularly some african nations and colombia are likely to be hurt the most by the icos failure to agree quotas analysts said the expected drop in prices could result in losses of as much as three billion dlrs in a year producer delegates forecast the ico executive board will meet march but the full council is not due to meet again until september delegates said
training,coffee,0000202,ico talks on coffee quotas to resume at noon london march talks on coffee export quotas at the international coffee organization ico special council session will resume at noon gmt today following a last minute decision taken early this morning to extend the meeting hours ico officials said an member contact group will meet at midday to examine new ideas and the full council is to convene at gmt they said the extension resulted from a last ditch effort by colombia to salvage the talks which by late yesterday looked perilously close to ending without agreement on quotas delegates said
training,coffee,0002096,brazil treasury to release coffee buying funds rio de janeiro march the treasury department is due to release funds for the brazilian coffee institute ibc to pay for the coffee purchased from local producers the ibc said in a statement ibc production director oripes gomes said in the statement that payment would be made within the official guarantee prices the statement said the ibc is sending a document to the national monetary council asking the government to set a budget for the purchase by the institute of up to five mln bags of coffee until june gomes said in the statement there have been no problems in the concession of funds by the treasury for payment of the coffee delivered to the ibc warehouses by the producers he said producers have already delivered mln bags of which mln bags have been paid for in the future according to an agreement to be signed with the treasury the institute will no longer need to seek approval by the treasury to seek the release of additional funds to buy coffee the statement said
training,coffee,0007985,guatemala to host other milds coffee meeting london march guatemala will host a meeting of other milds coffee producers probably in may to discuss basic export quotas the guatemalan delegate to the international coffee organization ico said no firm date has been set for the talks ambassador rene montes told reporters at the ico executive board meeting here producer countries brazil colombia and a member of oamcaf the african and malagasy coffee organization may also be invited for consultation he said ico producers and consumers could not agree on how to calculate export quota shares at a recent council meeting here other milds coffee producers include costa rica dominican republic ecuador el salvador guatemala honduras india mexico nicaragua papua new guinea and peru
training,coffee,0007915,ico board passes over coffee quota issue author by lisa vaughan reutersauthor london march executive board members of the international coffee organization ico passed over the issue of export quota negotiations at its regular meeting here delegates said no move was made to reopen dialogue on export quotas and no further discussion on the issue is likely during the threeday talks they said producer and consumer members of the ico council failed to agree export quota shares in early march neither brazil the largest producer nor the us the largest consumer are ready to be flexible delegates said the situation is unchanged consumer spokesman abraham van overbeeke told reporters as long as brazil sticks to its position there will not be quotas there is no point in meeting at the last council meeting brazil wanted to maintain its previous quota share of around pct of the market consumers and a splinter group of eight producers favoured redistribution of export shares using objective criteria which would likely have reduced brazils share brazilian delegate lindenberg sette said that if quota negotiations were to resume the mln bag shortfall brazil was willing to give up in early march if the producer proposal was accepted would no longer be on the table as we said from the startno agreement no one million bags he told reuters shortfalls of bags offered by oamcaf the african and malagasy coffee organization and bags offered by angola are also no longer valid delegates said the closest the board came to discussing quotas was a briefing by the guatemalan ico delegate rene montes on a recent latin american producers meeting in managua delegates said there the producers expressed their political will to negotiate basic quotas particularly in the face of the damaging drop in coffee prices after the council failed to agree quotas montes said the ico board also reviewed export statistics and stock verification they expected talks on stock verification to take up the remainder of todays session delegates said
training,coffee,0009045,dutch green coffee imports fall in january heerlen april dutch green coffee imports fell to tonnes in january from tonnes in january and exports fell to tonnes from the central bureau of statistics said imports of colombian coffee were tonnes in january brazilian indonesian guatemalan cameroun and ivory coast
training,coffee,0008474,restoration of coffee export quotas before october seems unlikely ico producer delegates
training,coffee,0008051,csce alters rules on trading limits new york march the coffee sugar and cocoa exchange amended regulations governing expanded trading limits on coffee cocoa and sugar contracts to provide uniformity effective today the exchange will permit normal daily price limits in those commodities to expand whenever the first two limited contract months move the limit in the same direction for two consecutive sessions the normal daily limits will be reinstated once the first two limited deliveries close by less than the normal limit for two successive trading days previously exchange rules required the first three limited months to move the limit in coffee and cocoa it had required the first two limited sugar deliveries to make such moves for three consecutive sessions
training,coffee,0007485,coffee prices bad news for latin america minister author by lisa vaughan reutersauthor london march a senior nicaraguan official said a recent plunge in coffee prices was economically and politically disastrous for latin american coffeeproducing countries nicaraguan foreign trade minister alejandro martinez cuenca was in london to brief international coffee organisation ico executive board producer members after a meeting last weekend in managua attended by eight latin american coffee producers to discuss the fall in coffee prices london coffee prices slid stg per tonne in march to stg from stg at endfebruary martinez told reporters the price fall since the ico failed to agree export quotas on march has had disastrous results on latin america both economically and politically he urged continued negotiations among coffee producers to pave the way for a coffee export quota agreement by september coffee export quotas used to regulate coffee prices under an international coffee agreement were suspended a year ago when prices soared in response to a drought in brazil central american economic ministers have estimated the region will lose mln dlrs in foreign exchange earnings in if coffee prices are not rescued by a quota arrangement martinez said he said ico quota talks broke down last month because consumer members lack the political will to fully support commodity agreements and because consumers tried to dictate to producers
training,coffee,0009321,philippine coffee exports seen falling sharply manila april philippine coffee exports are expected to fall sharply due to a combination of the international coffee organisations ico decision not to revive export quotas and higher local prices ico certifying agency official dante de guzman told reuters he said exporter registrations dropped from an average weekly tonnes in march to tonnes last week with exports in coffee year ending september forecast to total about tonnes against in because of the relatively higher level of domestic prices it has become difficult to service exports de guzman said adding that most exporters are taking a wait and see attitude coffee production was expected to drop slightly to about one mln bags of kg each in the crop year ending june from mln bags last year he said
training,coffee,0001195,thai coffee exports rise in bangkok march thai coffee exports rose to tonnes in from a year earlier the customs department said
training,coffee,0001562,coffee fall not seen affecting colombias debt bogota march the sharp fall in international coffee prices will not affect colombias external credit situation finance minister cesar gaviria told reuters he said the current depression on world coffee markets was not totally unexpected and would have no immediate bearing on colombias financial state which he described as sound our foreign debt is high but we can pay and i hope the foreign banking community will maintain its position toward us he said colombia the only major latin american country not to have rescheduled its external public debt has a total foreign debt of billion dlrs calls for a rescheduling of the debt have come this week from the opposition conservative party and the biggest trade union following the coffee price drop gaviria said lower coffee prices this year could mean a loss of billion dlrs in revenues for gaviria submitted to the world bank and the interamerican bank last week in new york a borrowing plan for a total of billion dlrs to be disbursed over the next four years which he said was approved
training,coffee,0001671,ico quota talks failure paralyse hamburg market hamburg march the failure of international coffee organization talks on the reintroduction of quotas has paralysed business on the hamburg green coffee market in the past week trade sources said there was only sporadic activity for spot material which was mainly requirement buying they said adding that preregistered coffees were no longer available they said they expected brazil and colombia to open export registrations for may shipment next week however the president of the brazilian coffee institute jorio dauster said yesterday he had not yet decided when its registrations would reopen
training,coffee,0004983,drought may reduce zimbabwe coffee output growers harare march zimbabwes projected coffee output of tonnes for could be reduced by drought growers said the main coffee growing areas in eastern zimbabwe have received little rain since april and the coffee growers association has begun a survey to assess the effects of the drought a spokesman said zimbabwe exported tonnes of coffee in mainly to west germany britain japan the netherlands switzerland and the united states
