origem,topico,arquivo,texto
training,wpi,0001238,belgian wholesale prices fall in january brussels march belgian wholesale prices fell by pct in january from a year earlier after a pct year on year fall in december figures from the economics ministry show a ministry spokesman said the wholesale price index base and excluding value added tax stood at in january this compared with in december in januay and in december in january wholesale prices were pct lower than a year earlier
training,wpi,0003290,us producer prices rose pct in feb after pct jan rise blah blah blah
training,wpi,0004430,german producer prices fall pct in february wiesbaden march west german producer prices fell pct in february from january and were pct below prices in february last year the federal statistics office said in january producer prices rose pct from december the first monthly rise since october but they were down pct from a year earlier the statistics office said light heating oil producer prices fell pct in february from january while heavy heating oil prices fell pct
training,wpi,0004018,japan wholesale prices fall pct in february tokyo march japans overall wholesale price index base fell pct in february from a month earlier to for the second consecutive monthonmonth fall the bank of japan said wholesale prices fell pct in january from december the index fell pct from a year earlier for the st straight yearonyear drop the central bank said the reduced monthonmonth drop mainly stemmed from the recovery in world crude oil prices it said on a customscleared basis crude oil prices rose to around dlrs a barrel in february from about dlrs in january the average value of the yen against the dollar rose pct to in february from in january and was up pct from a year earlier the bank said the export price index in february fell pct from a month earlier reflecting price cuts in export products like cars and precision instruments due to severe foreign competition the index was down pct from a year earlier the import price index rose pct from a month earlier to for the sixth successive monthonmonth gain mainly due to the continued strength of world crude oil prices but the index was down pct from a year earlier the domestic price index fell pct to in february its th straight monthly drop mainly reflecting falls in prices of home appliances such as colour televisions due to severe sales competition at home lower edible oil prices added to the decline the index was down pct from a year earlier the domestic index marked its largest yearonyear drop of pct in january since the central bank started compiling such statistics in under its current system wholesale prices are likely to turn upward in march as higher world crude oil and raw material prices are expected the bank said
training,wpi,0005302,danish wholesale prices fall pct in february copenhagen march denmarks wholesale price index fell pct in february giving a yearonyear fall of pct the national statistics office said the index base stood at in february a fall of one point compared to january against in february
training,wpi,0004017,japan february wholesale prices fall pct pct january drop official blah blah blah
training,wpi,0003238,s african producer price inflation falls sharply pretoria march south african yearonyear producer price inflation fell to pct in january against pct in december central statistics office figures show the all items index base rose a monthly pct in january to after also rising pct in december to a year ago the index stood at and yearonyear producer price inflation at pct
training,wpi,0003506,us producer energy prices rise in february washington march prices of wholesale finished energy goods in the united states were up in february rising by pct after a pct rise in january the labor department said the producer price index for finished energy goods has fallen pct in the past months heating oil prices rose pct in february after a pct rise in january the department said gasoline prices rose by pct last month after a pct january rise the department said natural gas prices rose pct after a pct rise in january energy goods at the intermediate stage of processing rose pct in february after rising pct in january and were down pct over the past months the labor department said prices for crude energy goods such as crude oil coal and gas at the wellhead rose pct last month after a pct january rise they were down pct from february the department said at the intermediate stage liquefied petroleum gas prices rose pct last month after a pct january rise and were pct below prices a year earlier the department said residual fuel prices rose pct in february after a pct rise a month earlier and were off pct in months electric power prices fell pct last month after a pct january decline and were down pct from a year ago crude oil prices rose pct in february after a pct january rise and were off pct from the year ago level prices of natural gas at the wellhead rose pct in february after rising pct a month earlier and were pct lower than they were months earlier the department said coal costs were down pct last month after rising pct in january and were down pct from a year ago
training,wpi,0003225,swiss wholesale prices fall pct in february berne march swiss wholesale prices fell by pct in february giving a drop of pct from february the federal office of industry trade and labour said prices had been unchanged in january giving an annual drop of pct they fell by pct in the year to february the wholesale price index base stood at in february from last year the office said the fall was largely due to lower prices for energy raw materials and semifinished goods consumer goods prices rose slightly
training,wpi,0006101,pakistan consumer price index falls in january karachi march pakistans consumer price index base fell to in january from in december and compared with a year ago the federal bureau of statistics said the wholesale price index same base rose to in january from in december and compared with in january
training,wpi,0008861,indias credit policy aims to control liquidity new delhi april indias credit policy package for fiscal aprilmarch will help ease inflationary pressures and control the growth of overall liqudity the reserve bank of india rbi said in a statement the package announced earlier this week will raise commercial bank statutory liquidity ratios to pct from pct effective april and will increase cash reserve ratios on foreign currency nonresident accounts to pct from three pct effective may it said excess liquidity pushed wholesale and consumer retail prices higher in on previous year levels rbi governor r n malhotra said in a statement malhotra said indias m money supply grew billion rupees in the fiscal year to march compared to a growth of billion in the same period the year before commercial bank aggregate deposits rose to billion in the same period against billion in the corresponding months of fiscal he said the finance ministry in a report issued in february predicted indias fiscal wholesale pricelinked inflation rate at about pct against pct in
training,lumber,0005897,timber realization trx to sell remaining acres chicago ill march timber realization co said it has agreed to sell its remaining acres of timberland property in mississippi for about mln dlrs in cash timber realization a limited partnership formed to dispose of timberlands and related properties transferred to it by the masonite corp said that when this sale is completed the partnership will have received about mln dlrs in cash and notes from the sale of its properties since december the partnership said it will terminate before august prior to that date the partnership said it expects to form a liquidating trust to provide for unresolved claims and liablities timber realization said the amount retained in that trust will depend on its experience in resolving open items up to the termination date but it added it expects to retain a substantial amount in the trust the partnership said it anticipates making a cash distribution of an as yet undetermined amount to unitholders at or before the liquidation trusts funding date
training,lumber,0003542,us says canada complying with lumber pact washington march the commerce department said that all canadian firms had begun to pay an agreed to pct surcharge on softwood shipped to us markets it made the statement after talks with canadian officials about press reports and speculation in canada that some exporters were not paying the charge canada and the united states agreed last december to the pct charge ending a lengthy trade dispute over alleged canadian subsidies to canadas softwood exporters commerce officials would not say if they found any canadian companies had been evading the charge but that following the talks they were convinced all exporters were complying with the agreement undersecretary of commerce bruce smart said we are gratified to learn that companies in canada have begun paying the export charge on lumber he added the agreement was important to the health of the us lumber industry and he intended to see that it was fully carried out
training,lumber,0003556,us says canada complying with lumber pact washington march the commerce department said all canadian firms have begun to pay an agreed pct surcharge on softwood shipped to us markets it made the statement after talks with canadian officials about rumors in canada that some exporters were not paying the charge canada and the us agreed last december to the pct charge ending a lengthy trade dispute over alleged canadian subsidies to canadas softwood exporters commerce officials declined to say if any canadian companies had been evading the charge but said following the talks they were convinced all exporters were complying with the agreement undersecretary of commerce bruce smart said we are gratified to learn that companies in canada have begun paying the export charge on lumber he added the agreement was important to the health of the us lumber industry and he intended to see that it was fully carried out
training,lumber,0005114,champion cha to expand alberta mill toronto march champion international corp based in stamford conn said it will expand its mill in hinton alberta at a cost of about mln canadian dlrs the expansion will double the facilitys pulping operation to short tons per year the mill produces softwood kraft pulp which is sold to other champion facilities and on the open market champion said it estimates the project will be completed by the end of
training,lumber,0008092,usdas amstutz sympathetic to wood credits washington march us agriculture undersecretary daniel amstutz said he was totally sympathetic with us wood producers desire to have their exports eligible for government credit guarantees but he told the senate appropriations agriculture subcommittee that including wood products in the departments short or intermediateterm export guarantee programs would conflict with us multilateral trade obligations currently us wood products are not eligible for government export credit guarantee because they are considered manufactured products amstutz said he said usda had devoted an enormous amount of time to considering making wood products eligible for the guarantees and that congress was considering a measure to do so
training,lumber,0005286,tropical forest death could spark new debt crisis author by eric hall reutersauthor tokyo march the death of the worlds tropical rain forests could trigger a new debt crisis and social and biological disasters scientists and ecologists involved with the international tropical timber organisation itto said at stake is the ability of developing nations including brazil mexico and the philippines to service their debts and the loss of trade worth hundreds of billions of dollars in important sectors such as agriculture and pharmaceuticals they said the experts gathering ahead of an itto meeting of consumers and producers near tokyo next week said the problem is already acute the philippines offers a textbook case of the economic dangers for many third world nations the loss of the forest is not just a loss of resources said delfin ganapin a philippine government consultant on environmental impact in the s we had mln hectares of commercial forest now we have one mln we have only around years of profitable logging left with a billion dlr debt the loss of logging foreign exchange earnings is serious he said about mln philippine people depend on upland areas that are now denuded and farmers cannot grow crops government security advisers say that as a direct result the most likely source of revolution in the philippines is in the upland areas said ganapin replanting is uneconomic and replanted tropical hardwoods have less than a pct chance of survival there is no known way to reproduce the wood or the millions of species within no replanting programme has been successful said almy hafild from the indonesian network for forest conservation ganapin said three billion dlrs would be needed in the next two years alone to save five mln hectares of critically denuded land in the philippines the experts say that without a major initiative from the development banks the vicious circle will continue with countries cutting more forest to help service shortterm debts at the cost of longterm insolvency yet timber a five billion dlr a year industry is not necessarily the most direct economic product of the forests and nations must be educated in how best to farm them said peter kramer world wildlife fund wwf conservation director there is a four billion dlr annual global trade in the end products of rattan and brazil nuts earn brazil mln dlrs a year he said us pharmacologist norman farnsworth has calculated that pct of all us prescriptions owe their active ingredients to higher plants growing in the forests deforestation would wipe out the chance of further discoveries and force major corporations to research develop and produce manmade substitutes at a cost which scientists say is incalculable by the year only developing nations will still be exporting timber from currently and their export earnings will drop from a peak of billion dlrs to less than two billion a world bank and un sponsored survey said of the billion dlrs advanced by the world bank interamerican african and asian development banks in only mln dlrs went to forestry projects it said wwf statistics show half of the worlds tropical forests have vanished since the s of mln hectares remaining up to mln are destroyed each year by destructive logging practises and by local farmers
training,lumber,0009127,plywood credits eyed by reagan administration washington april the reagan administration is debating whether to provide government credit guarantees for the export of plywood a us agriculture department official said as a member of the organization for economic cooperation and development oecd the united states has agreed not to provide any concessional credits on the export of manufactured products however usda general sales manager melvin sims told reuters the administration is considering allowing usda to provide its first export credit guarantees for plywood on the grounds it is not a manufactured product sims said it was clear that wood products such as furniture tables and window frames would be considered manufactured goods and therefore ineligible for export credit guarantees however the case of plywood was less clear as long as its a basic material we consider it still just a processed version of the basic agricultural commodity sims said in a telephone interview earlier today usda said that plywood was eligible under an export credit guarantee offer for turkey announced yesterday in its original announcement yesterday usda had said the offer included three mln dlrs for the export of lumber excluding plywood however sims said he did not expect any plywood exports to be including under the lumber guarantee offer
training,lumber,0002719,oregon lumber company to sell wood to iraq portland oregon march a portlandbased wood products company has signed a mln dlr contract with the iraqi government to supply finished softwood lumber to iraq edward niedermeyer president of niedermeyermartin co said yesterday niedermeyer told the house foreign affairs subcommittee on international economic policy and trade in washington that the sales agreement contains an option that could make lumber exported worth more than mln dlrs the delivery of about mln dlrs worth of plywood in addition to lumber hinges on whether the us department of agriculture will interpret plywood as an agricultural commodity under the credit guarantee program he said niedermeyer said the government export credit guarantee program gsm administered by the usda was the key to opening the iraqi market which up to now had been captured by scandinavian lumber producers this is the first time we have been able to sell wood products in iraq he said without the usda program it would not have been possible we hope this will lead to a long term export market for us lumber products he said the contract calls for supplying mln board feet to mln board feet of softwood lumber for housing construction and furniture manufacturing he estimated the profit potential for his company on the sale at five to six pct niedermeyer spent two weeks in baghdad negotiating the sale late last month and early march he is a member of the united statesiraq business forum a nonprofit group designed to promote commerce with iraq the forum members include westinghouse and general electric but niedermeyers company is the only wood products firm on the membership roster
training,lumber,0009125,usda corrects turkey credit announcement washington april the us agriculture department said an announcement by the department yesterday concerning mln dlrs in additional credit guarantees for exports of us commodities to turkey contained two inaccuracies first the usda said its announcement should not have said that plywood was excluded from the additional three mln dlrs in gsm credit guarantees for lumber the original announcement said the guarantees included three mln dlrs for lumber except plywood melvin sims usda general sales manager told reuters he did not anticipate any plywood would be included in the sales but that its possible it would be plywood in the past has not been eligible for gsm credit guarantees because it is considered by some to be a manufactured product members states of the organization for economic cooperation and development have pledged not to offer concessional credits on manufactured products sims said however the reagan administration is considering whether to allow plywood sales to be covered by the credit guarantee program sims said second the usda announcement said mln dlrs of a previously announced mln dlr line for tallow under gsm was available for both public and private sector importers in fact the line of credit guarantees for tallow is available only for public sector importers walter stern foreign agricultural service turkey analyst said
training,lumber,0001802,cme sets may start for lumber futures options chicago march the chicago mercantile exchange cme board of governors announced today the options on random length lumber futures will begin trading on may the contract received commodity futures trading commission cftc approval on january after being submitted for review last october initially only january march and may delivery months will be listed for trading the size of the underlying futures contract is board feet regular trading hours for the contract will be from to central time however on the first day of trading the market will open at on march the cme board amended the contract to eliminate christmas eve expirations for the january option this amendment has been submited to the cftc the cme said
training,coffee,0008606,ico talks set to end with no quota debate london april the international coffee organization executive board meeting will end tomorrow without any move to reopen the debate on restoring coffee export quotas delegates said talks have focused on administrative matters and verification of stocks in producer countries they said producers met briefly today to exchange views on the market situation but there seems little chance discussion on quotas will begin much before the icos annual council session in september they said delegates earlier thought the meeting would end tonight but a further session is scheduled tomorrow at gmt to complete reports on stock verification meantime the executive board will meet may to discuss possible action on the consultancy report on the ico presented today to the board consumer delegates said
training,coffee,0008891,seasonal stabilisation seen for coffee prices hamburg april the onset of cooler weather in brazil during the southern hemisphere winter is expected to have a stabilising effect on a weak coffee market west german trade sources said the annual fear of frost in brazil will probably grip the market sometime this month until june or early july one trader said the trade believes the international coffee organization ico is unlikely to tackle the reintroduction of quotas before its september meeting and until then the market will not see any unexpected sharp moves in either direction
training,coffee,0007320,india steps up countertrade deals new delhi march india is searching for noncommunist countertrade partners to help it cut its trade deficit and conserve foreign exchange wheat tobacco tea coffee jute engineering and electronic goods as well as minerals including iron ore are all on offer in return for crude oil petroleum products chemicals steel and machinery trade sources told reuters most of the impetus behind countertrade which began in comes from two state trading firms the state trading corp stc and the minerals and metals trading corp mmtc the two state trading corporations are free to use their buying power in respect to bulk commodities to promote indian exports a commerce ministry spokeswoman said adding that private firms are excluded from countertrading one trade source said india has targetted countries that depend on an indian domestic market recently opened to foreign imports but countertrade deals still make up only a small part of indias total trading and are likely to account for less than eight pct of the estimated billion dlrs in trade during the nine months ended december the sources said countertrade accounted for just five pct of indias billion dlrs in trade during fiscal ended march against almost nothing in official figures show however the figures exclude exchanges with the eastern bloc paid in nonconvertible indian rupees the sources said total trade with the soviet union involving swaps of agricultural produce and textiles for soviet arms and crude oil is estimated at billion dlrs in fiscal
training,coffee,0006796,ibc president not to attend ico executive board rio de janeiro march brazilian coffee institute ibc president jorio dauster said he will not attend the ico executive board meeting and was surprised to hear that a report of his absence had a slightly depressing effect on the new york coffee market today i have too much work to accomplish here in brazil at the moment besides the presence of the ibc president at an ico executive board meeting is not a tradition dauster said dauster said except in rare cases brazil has always sent its londonbased representative to ico board meetings ambassador lindenberg sette will attend the meeting he said
training,coffee,0006429,vietnam to resettle on state farms in bangkok march vietnam will resettle people on state farms known as new economic zones in to create jobs and grow more highvalue export crops the communist party newspaper nhan dan said yesterdays edition received here today said vietnam would invest one billion dong including the costs of relocation in new economic zones about one third of that sum would be spent on export crops such as coffee tea rubber and pepper in the central highlands it said since vietnam has resettled about three million people from cities and crowded river deltas to the zones
training,coffee,0007569,top qualities sought on hamburg coffee market hamburg march the green coffee market saw some demand for high quality coffees in the past week but business was described as generally unsatisfactory trade sources said especially sought were spot east african and ethiopian and some brazils they said adding that some high grade robustas also met some demand sporadic business was noted in the second hand which offered kenya coffee for mayjune shipment up to dlrs below origin levels roasters are said to be well covered and are not expected to enter the market for larger purchases in the near term
