origem,topico,arquivo,texto
training,wheat,0005973,us willing to talk to moscow on wheat price washington march us agriculture undersecretary dan amstutz indicated the united states is willing talk with the soviet union about the competitiveness of us wheat prices but would not discuss making us wheat prices cheap there sometimes is a difference between being competitive and being cheap amstutz told a senate agriculture appropriations hearing amstutz said the difference of opinion between moscow and washington last summer on the level of the us subsidy offered on wheat to the soviet union was over whether the us wheat price was competitive or cheap i think there is a us willingness to explore this issue as it pertains to competitiveness amstutz said however amstutz added that the united states would not be willing to discuss wheat prices with moscow if the issue is being cheap asked later by a reporter what he meant by the distinction between competitive and cheap amstutz would not elaborate amstutz said it is the us judgment that the longterm grain agreement between the two countries calls for moscow to buy at least four mln tonnes each of wheat and corn annually at prices in effect in this country amstutz made the comments in response to a question from sen charles grassley riowa about expanding the export enhancement program to include grain sales to the soviet union
training,wheat,0008150,usda puts march us wheat stocks at bu blah blah blah
training,wheat,0002675,usda accepts offers for tonnes of bonus wheat for china blah blah blah
training,wheat,0001123,more soviet grain buying from us tied to price washington march whether the soviet union will fulfill its buying obligations under the usussr grains agreement depends entirely on the united states a soviet trade official told reuters how can i tell that we are ready to fulfill the agreement if the united states does not want to offer us grain at competitive prices said albert melnikov deputy trade representative of the soviet union to the united states we are in the market for grains but it is up to the united states to be the seller to offer soviets competitive prices he said in an interview melnikov said that the united states has not lived up the agreement by failing to make available to moscow us grain at prevailing market prices we are being accused of not implementing this agreement we do not consider we are at fault melnikov said article i in the agreement states that purchasessales of commodities under this agreement will be made at the market price prevailing for these products at the time of purchasesale and in accordance with normal commercial terms the united states should supply to the soviet union definite quantities of grain at competitive prices is the united states ready to supply this he said the soviet official said that nearterm corn demand has been met by the recent soviet purchases of us corn which he confirmed at mln tonnes but said that if us corn prices remain competitive the soviets will buy more if they need it wheat buying however is a different story melnikov said if the united states is interested in selling its wheat then they must offer competitive prices and its up to the united states to decide how these competitive prices will be offered he said last years us offer of subsidized wheat to the soviets was rejected because of an insufficient subsidy melnikov said he said that at the time of the dlr per tonne subsidy offer us wheat prices were dlrs over world levels
training,wheat,0001289,french free market cereal export bids detailed paris march french operators have requested licences to export tonnes of free market feed wheat tonnes of soft bread wheat tonnes of barley and tonnes of maize at todays european community tender trade sources here said rebates requested ranged between and european currency units ecus a tonne for the feed wheat and ecus a tonne for the bread wheat and ecus for the barley and and ecus for the maize
training,wheat,0004258,china crop weather summary usdanoaa washington march light scattered showers covered winter wheat areas in the north china plain in the week ended march moistening topsoils for wheat just breaking dormancy in most central and northern areas the joint agricultural weather facility of the us agriculture and commerce departments said in its international weather and crop summary the agency said southern winter wheat areas are in the early vegetative stage abovenormal february temperatures over the north china plain caused winter grains to break dormancy early in the south moderate to heavy rains in southern jiangsu anhui eastern hebei hunan jiangxi fujian and zheziang reversed februarys below normal precipitation pattern the agency said the wet weather in these areas provided ample moisture for rice planting and lessened the need for irrigation mostly dry weather in earlyrice areas of guanxi and guandong resulted in irrigation for continued rice planting it said
training,wheat,0009516,honduras seeking pl vessels for bulk wheat washington april honduras will tender april under public law for us and nonus flag vessels to deliver approximately tonnes of various wheats in bulk an agent for the country said the agent said deliveries of northern springdns wheat will include laydays of july for tonnes august for tonnes and september for tonnes deliveries of hard red winter wheat will have laydays of june for tonnes july for tonnes and september for tonnes offers are due by hrs edt april and will remain valid until the close of business april the agent said
training,wheat,0001305,western canada hurt by international forces ottawa march western canadas resourcebased economy is being hurt by international market forces and there is little ottawa can do about it finance minister michael wilson said if you can tell me how we can get the international energy price up and how we can get the price for copper up and how we can get the price for wheat up then we will listen wilson told the house of comnons finance committee although under pressure from oil companies and wheat farmers for help in battling depressed commodity prices wilson said it has to be recognized the area was a prisoner of market forces outside the boundaries of this country wilson appearing before the committee to discuss the governments spending estimates released earlier this week said the government is doing what it can in the region citing more than billion dlrs in aid for western agriculture those resources are a reflection of very real concerns on our part in dealing with a very difficult problem wilson said in response to questions about management of the economy from opposition party members he said the long term answer for depressed regions of the country was reaching a free trade pact with the united states which he claimed would improve the outlook for western canada
training,wheat,0009397,uk intervention wheat sold to home market london april a total of tonnes of british intervention feed wheat were sold at todays tender for the home market the home grown cereals authority said bids amounted to tonnes against offerings of prices paid were at or above the prevailing intervention feed wheat price of stg per tonne grain traders said a large part of the tonnage on offer was in stores which would mean high transport costs to deficient areas the european commission recently made available tonnes for next weeks tender
training,wheat,0001270,ccc accepts bonus bid on semolina to egypt washington march the commodity credit corporation ccc has accepted a bid for an export bonus to cover a sale of tonnes of semolina to egypt the us agriculture department said the department said the bonus was dlrs per tonne and was made to international multifoods corp the bonus will be paid in the form of commodities from ccc stocks the semolina is for shipment during june it said an additional tonnes of semolina are still available to egypt under the export enhancement program initiative announced on august it said
training,wheat,0000893,cbt traders look ahead to spring plantings chicago march chicago board of trade grain traders and analysts voiced a lot of interest in how farmers planned to handle their upcoming spring plantings prompting sales of new crop months of corn and oats and purchases in new crop soybeans in the futures markets professionals in the grains trade think that farmers will be more willing to stick with corn acres than soybeans because corn is protected by the acreage reduction program that gives deficiency payments to farmers if corn prices stay low farmers can place soybeans under the loan program if they signup for reduced acreage but they have no price guarantees with the price outlook for both commodities so dismal traders believe farmers will want to stick with a sure thing rather than gamble on soybeans even though the new crop soybeancorn ratio of would make planting soybeans more attractive under normal circumstances an announcement late friday that the usda will lift the limited crosscompliance requirement for the oats crop means farmers will be able plant an estimated two to three mln more oat acres this year than last without being penalized traders said here too acres some farmers may have been thinking of shifting to soybeans will now be planted with oats due to the more attractive deal from the government they added cotton prices are almost twice what they were just six months ago which should prompt many farmers in the south to put soybean land back into cotton one of the reasons for the steady increase in soybean production in recent years has been a general shift of acres in traditional cotton producing regions of the south to soybeans which are easier to grow one commercial trader said
training,wheat,0001242,uk grainpotato futures volume down in february london march traded volumes for uk grain and potato futures in february were down on the previous month while pigmeat and pig cash settlement futures were higher official figures show combined wheat and barley futures trade declined to tonnes from mln in january and the value fell to mln stg from mln grain and feed trade association gafta figures show a total of tonnes were registered for main crop potato futures in february valued at mln stg versus and mln stg in january soymeal futures trade totalled tonnes against in january and value declined to nine mln stg from mln nine pigmeat contracts were traded in february six more than in the previous month representing carcases against valued at stg against stg pig cash settlement futures saw contracts traded against in january and the value rose to stg from stg
training,wheat,0008643,us farm reorganizations proving costly gao washington april us farmers who reorganize their operations to circumvent a cap on federal payments could add billion dlrs to the cost of the governments agricultural programs by the general accounting office gao said we estimate that should the trend in farm reorganizations continue reorganizations since could be adding almost mln dlrs annually to program costs by gao senior associate director brian crowley said cumulative costs for the sixyear period to could approach billion dlrs he said between and reorganizations added almost new persons to us agriculture department payment rolls crowley told the house agriculture subcommittee on wheat soybeans and feedgrains
training,wheat,0006328,us wheat credits for jordan switched washington march the commodity credit corporation ccc has switched mln dlrs in wheat credit guarantees to jordan under the export credit guarantee program to the intermediate export credit guarantee program the us agriculture department said the switch reduces the total value of gsm guarantees for the current fiscal year to mln dlrs the credit terms extended for export sales under the intermediate export credit guarantee program gsm must be in excess of three years but not more than seven years all sales must be registered and exports completed by september the department said
training,wheat,0008017,tunisia tender expected for tonnes wheat paris march tunisia is expected to tender shortly for tonnes of soft wheat for shipment between april and june covered by coface export credits trade sources said over tonnes of french soft wheat have been sold to tunisia since the beginning of the campaign of which to tonnes have already been shipped they said
training,wheat,0005569,ccc accepts export bonus on semolina to egypt washington march the commodity credit corporation ccc has accepted a bid for an export bonus to cover a sale of tonnes of semolina to egypt the us agriculture department said the department said the semolina is for shipment apriloctober and the bonus awarded was dlrs per tonne the bonus was made to international multifoods corp and will paid to the exporter in the form of commodities from ccc stocks the department said an additional tonnes of semolina are still available to egypt under the export enhancement program initiative announced august it said
training,wheat,0005893,us farm policy debate could hit senate soon washington march the senate this week might take up proposed legislation that could serve as a lightning rod to expose broad initiatives to change us farm policy the senate could consider a housepassed bill that would allow wheat and feedgrains farmers to receive at least pct of their income support payments if flooding last year prevented or will prevent them from planting their crops senate staff members told reuters also pending is a bill extend the life of the national commission on dairy policy sen rudy boschwitz rminn intends to offer an amendment to one of the bills that would suspend the minimum planting requirement for all wheat feedgrain cotton and rice producers an aide said under current law producers must plant at least pct of their base acreage to be eligible for pct of their deficiency payments most major us farm groups have lobbied hard against making any fundamental changes in the farm bill out of fear a fullscale debate could expose agricultural problems to budgetcutting pressures representatives of these farm groups have said they also fear efforts by midwestern democrats to force a floor vote on a bill that would require large acreage setasides in return for sharply higher support prices however sen tom harkin diowa sponsor of the bill told reuters he did not intend to offer his measure as a floor amendment but to bring it through the committee
training,wheat,0003265,us lends sudan mln dlrs for wheat purchases khartoum march the us is to lend sudan mln dlrs to buy tonnes of wheat and tonnes of wheat flour according to an agreement signed here under the agreement sudan will receive mln dlrs for the commodities and the rest for sea transportation the loan is repayable in years including a year grace period interest will be two pct for the grace period and three pct over the repayment period of years
training,wheat,0000663,uk wheat and barley exports adjusted upwards london march the uk exported tonnes of wheat and tonnes of barley in january the home grown cereals authority hgca said quoting adjusted customs and excise figures based on the previous january figures issued on february wheat exports increased by nearly tonnes and barley by about tonnes the new figures bring cumulative wheat exports for the period july february to mln tonnes and barley to mln compared with and mln tonnes respectively a year ago january wheat exports comprised tonnes to european community destinations and tonnes to third countries the soviet union was prominent in third country destinations taking tonnes while poland was credited with and south korea tonnes italy was the largest ec recipient with tonnes followed by west germany with and france tonnes barley exports for january comprised tonnes to the ec and to third countries the soviet union was the largest single importer with tonnes followed by saudi arabia with tonnes
training,wheat,0001189,unusually dry weather affects chinas agriculture peking march abnormally warm and dry weather over most parts of china is seriously affecting crops the new china news agency said it said the drought has made rice planting difficult in eight provinces including guangxi sichuan and hunan plant diseases and insect pests have increased in wheatproducing areas it said the agency said some areas of guangxi hubei shanxi and other provinces have been suffering a drought for more than seven months the agency said the dry weather had reduced the amount of water stored by more than pct compared with last march lowered the water level of many rivers reduced hydroelectric power supplies and caused water shortages for industry and consumers the upper reaches of the yangtze are at their lowest levels in a century causing many ships to run aground and making harbour manoeuvres difficult it said the drought has also increased the number of forest fires more than fires in southern china had destroyed hectares of forest by midfebruary it said
training,wheat,0009037,london grains sees wheat recover from lows london april uk physical wheat values recovered from initial losses of one to two stg per tonne caused by overnight news of the release of an additional tonnes of intervention feed wheat for uk weekly home market tenders consumer buyers were attracted by the cheaper offers traders said and by early afternoon the market had recovered to one stg down to unchanged uk wheat futures also rallied to end the morning unchanged to stg easier in east anglia april deliveries of feed wheat traded at and may at but were subsequently bid one stg a tonne the market for denaturable wheat in liverpool held comparatively steady with sellers holding back due to uncertain conditions april deliveries made and june stg per tonne basis liverpool the fob market for wheat started easier but here again selling pressure lifted around midday aprjun shipments traded fob east coast at stg per tonne this compared with paid for april yesterday and for mayjune
training,wheat,0008809,us house panel extends eep urges ussr offer washington april the us house agriculture committee approved proposals to extend the life of the export enhancement program eep through fiscal and urged the reagan administration offer eep wheat to the soviet union the proposals were approved as amendments to a comprehensive trade bill moving through congress this year in addition to the amendments on eep the committee approved several proposals which could restrict imports of lamb casein sugarcontaining products and tobacco those amendments affecting imports face an uncertain future because the house ways and means committee which has overall jurisdiction over trade legislation will oppose them congressional sources said the effect of the eep amendments would be to extend the life of the program five years through fiscal rather than the current three years through fiscal the amendments offered by rep dan glickman dkan also would increase funding for the program to billion dlrs from billion now furthermore the committee passed an amendment offered by rep glickman which instructs the us agriculture department to value eep bonus commodities at market value not acquisition value glickman said the change would make the program pct less expensive to operate the provision on eep wheat to the soviet union offered by rep bob smith rore does not require the administration make an offer but urges such action the committee approved an amendment offered by rep glenn english dokla requiring the secretary of agriculture to begin discussions with other major grain producing countries aimed at jointly reducing world grain production trade representative clayton yeutter yesterday opposed the amendment saying such commodity agreements do not work among the host of amendments to restrict imports approved by the panel the most significant would require quotas on imports of goods containing more than pct of a bulk farm product that is subject to us quotas the amendment offered by rep arlan stangeland rminn is aimed primarily at curbing imports from canada of products containing sugar and foreign foods containing dairy products it also may affect peanut cotton and tobacco imports committee sources said another amendment would place a quota on us imports of casein a dairy product shipped to the us primarily by new zealand and ireland the panel also voted to apply to lamb imports the same countercyclical import quota law which is operating for us beef imports other miscellaneous amendments included urging the administration consider retaliating against japan and south korea if those countries do not remove restrictions on beef imports boosting the amount of us grain which must be shipped each year under a food aid program called section to tonnes from tonnes now requiring the agriculture secretary conduct a study of the canadian wheat board import licensing system for wheat to determine if it is a nontariff trade barrier requiring the agriculture secretary reimburse the national corn growers association up to dlrs for the costs of defending the us feedgrains program against a canadian countervailing duty case this year urging the administration oppose the canadian decision to apply a duty on us corn imports and a proposal by the european community to apply a vegetable oils tax usda conduct a study of the findings of a national commission on agricultural export policy which recommended a reorganization of usdas trade policy apparatus
training,wheat,0008026,winter weather hurts east german grain usda washington march shifts from mild to very cold weather in east germany damaged winter barley and late sown winter wheat in central regions and barley north of berlin the us agricultural officer in east berlin said in a field report the officer said indications were that winter kill might well be more than hectares compared with last year he said the damage was probably more limited in southern and central regions and most widespread in the north damage was most severe on plants above the ground where little or no snow cover was present he added the officer said heavy frosts at night followed by sunshine during the day led to some heaving particularly for well developed plants and for winter barley furthermore as the ground surface thawed some standing water occurred in the fields the officer said repairing damage will probably call for special measures this spring in fields with damaged plants and where stands are thin harrowing as well as welltimed applications of nitrogen will be necessary he added
training,wheat,0008039,french market talk of syrian wheat purchases paris march syria may have bought tonnes of french soft wheat some traders here said but others said it may instead have given payment guarantees to allow for the shipping of an old contract to go ahead syria has bought around tonnes of soft french wheat since the beginning of the campaign of which only tonnes had been exported by the end of last month the country also bought around tonnes of ec soft wheat days ago at to dlrs a tonne fob they said
training,wheat,0007738,us export inspections in thous bushels soybeans wheat corn blah blah blah
training,wheat,0001395,world grain trade recovery may be underway minneapolis march world grain trade could be turning the corner and heading toward recovery in the season a cargill inc analyst said writing in the march issue of the cargill bulletin david rogers of cargills commodity marketing division cited a gradual rise in world wheat trade in recent months with a slow rise in wheat prices after recent historic lows he said the wheat trade because wheat can be produced in many nations is a good barometer of world grain trade and could lead to more activity in other grain markets rogers said that with world grain prices at their lowest level in over a quarter of a century in real terms demand has begun to rise while producing nations are reexamining their expensive pricesupport policies and reducing planted acres
